Book_URL,Summary,Genres
/book/show/98807.Subterranean,"Travel to the bottom of the earth to a place you never dreamed existed. Beneath the ice a hand-picked team of specialist makes its way toward the center of the world. They are not the first to venture into this magnificent subterranean labyrinth. Those they follow did not return.Over the rocks...Across the yawning caverns...beyond the black river...You are not alone. Into the darkness where breathtaking wonders await you-and terrors beyond imagining...Revelations that could change the world-things that should never be disturbed...At the bottom of the earth is the beginning. Keep moving toward a miracle that cannot be, toward a mystery older than time.","Thriller, Fiction, Adventure, Action, Science Fiction, Mystery, Suspense"
/book/show/7278752-dolores-claiborne,"Suspected of killing Vera Donovan, her wealthy employer, Dolores Claiborne tells police the story of her life, harkening back to her disintegrating marriage and the suspicious death of her violent husband, Joe St. George, thirty years earlier. Dolores also tells of Vera's physical and mental decline and of her loyalty to an employer who has become emotionally demanding in recent years.","Horror, Fiction, Thriller, Mystery, Audiobook, Crime, Suspense"
/book/show/5720.Rainbow_Six,"Over the course of nine novels,Tom Clancy’s “genius for big, compelling plots” and his “natural narrative gift” (The New York Times Magazine) have mesmerized hundreds of millions of readers and established him as one of the preeminent storytellers of our time.Rainbow Six, however, goes beyond anything he has done before.At its heart is John Clark, the ex-Navy SEAL ofWithout Remorse, well known from several of Clancy's novels as a master of secret operational missions. Whether hunting warlords in Japan, druglords in Colombia, or nuclear terrorists in the United States, Clark is efficient and deadly, but even he has ghosts in his past, demons that must be exorcised. And nothing is more demonic than the peril he must face inRainbow Six.Newly named the head of an international task force dedicated to combating terrorism, Clark is looking forward to getting his teeth into a new mission, but the opportunities start coming thicker and faster than anyone could have expected: an incident at a Swiss bank, the kidnapping of an international trader in Germany, a terrible raid on an amusement park in Spain.Each episode seems separate, discrete, yet the timing disturbs Clark. Is there a connection? Is he being tested? With the help of his close associates, executive officer Alistair Stanley and strike team leaders Domingo Chavez and Peter Covington, Clark tries to figure out where all this activity is heading, but there is no way to predict the real threat: a group of terrorists like none the world has ever encountered, a band of men and women so extreme that their success could literally mean the end of life on Earth as we know it.","Fiction, Thriller, Military Fiction, Action, Espionage, Adventure, Suspense"
/book/show/123598.Black_Notice,"An intriguing Dr Kay Scarpetta novel which will take Kay an ocean's breadth away from home. The case begins when a cargo ship arriving at Richmond, Virginia's Deep Water Terminal from Belgium is discovered to be transporting a locked, sealed container holding the decomposed remains of a stowaway. The post mortem performed by the Chief Medical Examiner, Kay Scarpetta, initially reveals neither a cause of death nor an identification. But the victim's personal effects and an odd tattoo take Scarpetta on a hunt for information that leads to Interpol's headquarters in Lyon, where she receives critical instructions: go to the Paris morgue to receive secret evidence and then return to Virginia to carry out a mission. It is a mission that could ruin her career. In a story which crosses international borders, BLACK NOTICE puts Dr Kay Scarpetta directly in harm's way and places her and those she holds dear at mortal risk.","Mystery, Fiction, Crime, Thriller, Mystery Thriller, Suspense, Murder Mystery"
/book/show/34390820-two-kinds-of-truth,"Harry Bosch is back as a volunteer working cold cases for the San Fernando Police Department and is called out to a local drug store where a young pharmacist has been murdered. Bosch and the town's 3-person detective squad sift through the clues, which lead into the dangerous, big business world of pill mills and prescription drug abuse.Meanwhile, an old case from Bosch's LAPD days comes back to haunt him when a long-imprisoned killer claims Harry framed him, and seems to have new evidence to prove it. Bosch left the LAPD on bad terms, so his former colleagues aren't keen to protect his reputation. He must fend for himself in clearing his name and keeping a clever killer in prison.The two unrelated cases wind around each other like strands of barbed wire. Along the way Bosch discovers that there are two kinds of truth: the kind that sets you free and the kind that leaves you buried in darkness.","Mystery, Fiction, Crime, Thriller, Audiobook, Detective, Mystery Thriller"
/book/show/183822.Sandstorm,"An inexplicable explosion rocks the antiquities collection of a London museum, setting off alarms in clandestine organizations around the world.And now the search for answers is leading Lady Kara Kensington; her friend Safia al-Maaz, the gallery's brilliant and beautiful curator; and their guide, the international adventurer Omaha Dunn, into a world they never dreamed existed: a lost city buried beneath the Arabian desert.But others are being drawn there as well, some with dark and sinister purposes. And the many perils of a death-defying trek deep into the savage heart of the Arabian Peninsula pale before the nightmare waiting to be unearthed at journey's end: an ageless and awesome power that could create a utopia... or destroy everything humankind has built over countless millennia.","Thriller, Fiction, Adventure, Mystery, Action, Science Fiction, Mystery Thriller"
/book/show/40109367-dare-to-lead,"In her #1 NYT bestsellers, Brené Brown taught us what it means to dare greatly, rise strong and brave the wilderness. Now, based on new research conducted with leaders, change makers and culture shifters, she’s showing us how to put those ideas into practice so we can step up and lead.Leadership is not about titles, status and power over people. Leaders are people who hold themselves accountable for recognising the potential in people and ideas, and developing that potential. This is a book for everyone who is ready to choose courage over comfort, make a difference and lead.When we dare to lead, we don't pretend to have the right answers; we stay curious and ask the right questions. We don't see power as finite and hoard it; we know that power becomes infinite when we share it and work to align authority and accountability. We don't avoid difficult conversations and situations; we lean into the vulnerability that’s necessary to do good work.But daring leadership in a culture that's defined by scarcity, fear and uncertainty requires building courage skills, which are uniquely human. The irony is that we're choosing not to invest in developing the hearts and minds of leaders at the same time we're scrambling to figure out what we have to offer that machines can't do better and faster.What can we do better?Empathy, connection and courage to start.Brené Brown spent the past two decades researching the emotions that give meaning to our lives. Over the past seven years, she found that leaders in organisations ranging from small entrepreneurial start-ups and family-owned businesses to non-profits, civic organisations and Fortune 50 companies, are asking the same questions:How do you cultivate braver, more daring leaders? And, how do you embed thevalue of courage in your culture?Dare to Leadanswers these questions and gives us actionable strategies and real examples from her new research-based, courage-building programme.Brené writes, ‘One of the most important findings of my career is that courage can be taught, developed and measured. Courage is a collection of four skill sets supported by twenty-eight behaviours. All it requires is a commitment to doing bold work, having tough conversations and showing up with our whole hearts. Easy? No. Choosing courage over comfort is not easy. Worth it? Always. We want to be brave with our lives and work. It's why we're here.’","Nonfiction, Leadership, Business, Self Help, Audiobook, Personal Development, Psychology"
/book/show/570172.The_Brain_that_Changes_Itself,"An astonishing new science called neuroplasticity is overthrowing the centuries-old notion that the human brain is immutable. Psychiatrist and psychoanalyst, Norman Doidge, M.D., traveled the country to meet both the brilliant scientists championing neuroplasticity and the people whose lives they’ve transformed - people whose mental limitations or brain damage were seen as unalterable. We see a woman born with half a brain that rewired itself to work as a whole, blind people who learn to see, learning disorders cured, IQs raised, aging brains rejuvenated, stroke patients learning to speak, children with cerebral palsy learning to move with more grace, depression and anxiety disorders successfully treated, and lifelong character traits changed. Using these marvelous stories to probe mysteries of the body, emotion, love, sex, culture, and education, Dr. Doidge has written an immensely moving, inspiring book that will permanently alter the way we look at our brains, human nature, and human potential.","Nonfiction, Science, Psychology, Neuroscience, Brain, Health, Self Help"
/book/show/58371432-the-book-of-cold-cases,"In 1977, Claire Lake, Oregon, was shaken by the Lady Killer Murders: Two men, seemingly randomly, were murdered with the same gun, with strange notes left behind. Beth Greer was the perfect suspect--a rich, eccentric twenty-three-year-old woman, seen fleeing one of the crimes. But she was acquitted, and she retreated to the isolation of her mansion.Oregon, 2017.Shea Collins is a receptionist, but by night, she runs a true crime website, the Book of Cold Cases--a passion fueled by the attempted abduction she escaped as a child. When she meets Beth by chance, Shea asks her for an interview. To Shea's surprise, Beth says yes.They meet regularly at Beth's mansion, though Shea is never comfortable there. Items move when she's not looking, and she could swear she's seen a girl outside the window. The allure of learning the truth about the case from the smart, charming Beth is too much to resist, but even as they grow closer, Shea senses something isn't right. Is she making friends with a manipulative murderer, or are there other dangers lurking in the darkness of the Greer house?A true crime blogger gets more than she bargained for while interviewing the woman acquitted of two cold case slayings in this chilling new novel from theNew York Timesbestselling author ofThe Sun Down Motel.","Mystery, Thriller, Mystery Thriller, Fiction, Horror, Audiobook, Paranormal"
/book/show/85990.Princess_Academy,"Miri lives on a mountain where, for generations, her ancestors have quarried stone and lived a simple life. Then word comes that the king's priests have divined her small village the home of the future princess. In a year's time, the prince himself will come and choose his bride from among the girls of the village. The king's ministers set up an academy on the mountain, and every teenage girl must attend and learn how to become a princess.Miri soon finds herself confronted with a harsh academy mistress, bitter competition among the girls, and her own conflicting desires to be chosen and win the heart of her childhood best friend. But when bandits seek out the academy to kidnap the future princess, Miri must rally the girls together and use a power unique to the mountain dwellers to save herself and her classmates.","Fantasy, Young Adult, Middle Grade, Fiction, Childrens, Romance, Fairy Tales"
/book/show/81153.Briar_Rose,"A powerful retelling ofSleeping Beautythat is ""heartbreaking and heartwarming.""An American Library Association ""100 Best Books for Teens""An American Library Association ""Best Books for Young Adults""Ever since she was a child, Rebecca has been enchanted by her grandmother Gemma's stories about Briar Rose. But a promise Rebecca makes to her dying grandmother will lead her on a remarkable journey to uncover the truth of Gemma's astonishing claim:I am Briar Rose. A journey that will lead her to unspeakable brutality and horror. But also to redemption and hope.","Young Adult, Historical Fiction, Fantasy, Fiction, Fairy Tales, Historical, Holocaust"
/book/show/5364.Dragonfly_in_Amber,"An alternate cover edition can be foundhere.From the author ofOutlander... a magnificent epic that once again sweeps us back in time to the drama and passion of 18th-century Scotland...For twenty years Claire Randall has kept her secrets. But now she is returning with her grown daughter to Scotland's majestic mist-shrouded hills. Here Claire plans to reveal a truth as stunning as the events that gave it birth: about the mystery of an ancient circle of standing stones ...about a love that transcends the boundaries of time ...and about James Fraser, a Scottish warrior whose gallantry once drew a young Claire from the security of her century to the dangers of his ....Now a legacy of blood and desire will test her beautiful copper-haired daughter, Brianna, as Claire's spellbinding journey of self-discovery continues in the intrigue-ridden Paris court of Charles Stuart ...in a race to thwart a doomed Highlands uprising ...and in a desperate fight to save both the child and the man she loves....","Historical Fiction, Romance, Fantasy, Fiction, Time Travel, Historical, Historical Romance"
/book/show/7141642-the-thousand-autumns-of-jacob-de-zoet,"The year is 1799, the place Dejima in Nagasaki Harbor, the “high-walled, fan-shaped artificial island” that is the Japanese Empire’s single port and sole window onto the world, designed to keep the West at bay; the farthest outpost of the war-ravaged Dutch East Indies Company; and a de facto prison for the dozen foreigners permitted to live and work there. To this place of devious merchants, deceitful interpreters, costly courtesans, earthquakes, and typhoons comes Jacob de Zoet, a devout and resourceful young clerk who has five years in the East to earn a fortune of sufficient size to win the hand of his wealthy fiancée back in Holland.But Jacob’s original intentions are eclipsed after a chance encounter with Orito Aibagawa, the disfigured daughter of a samurai doctor and midwife to the city’s powerful magistrate. The borders between propriety, profit, and pleasure blur until Jacob finds his vision clouded, one rash promise made and then fatefully broken. The consequences will extend beyond Jacob’s worst imaginings. As one cynical colleague asks, “Who ain’t a gambler in the glorious Orient, with his very life?”A magnificent mix of luminous writing, prodigious research, and heedless imagination,The Thousand Autumns of Jacob de Zoetis the most impressive achievement of its eminent author.","Fiction, Historical Fiction, Japan, Historical, Literary Fiction, Asia, Novels"
/book/show/12982393-dare-me,"""Tense, dark, and beautifully written"" (Gillian Flynn), this novel of friendship and betrayal from an Edgar Award-winning author is a harrowing glimpse into the dark heart of the all-American girl.Addy Hanlon has always been Beth Cassidy's best friend and trusted lieutenant. Beth calls the shots and Addy carries them out, a long-established order of things that has brought them to the pinnacle of their high-school careers. Now they're seniors who rule the intensely competitive cheer squad, feared and followed by the other girls—until the young new coach arrives.Cool and commanding, an emissary from the adult world just beyond their reach, Coach Colette French draws Addy and the other cheerleaders into her life. Only Beth, unsettled by the new regime, remains outside Coach's golden circle, waging a subtle but vicious campaign to regain her position as ""top girl""—both with the team and with Addy herself.Then a suicide focuses a police investigation on Coach and her squad. After the first wave of shock and grief, Addy tries to uncover the truth behind the death—and learns that the boundary between loyalty and love can be dangerous terrain.The raw passions of girlhood are brought to life in this taut, unflinching exploration of friendship, ambition, and power. Writing with ""total authority and an almost desperate intensity"" (Tom Perrotta), award-winning novelist Megan Abbott delivers a story as unnerving and thrilling as adolescence itself.""Spectacular . . . It'sHeathersmeetsFight Clubgood.""—Chelsea Cain, theNew York Times Book Review","Fiction, Young Adult, Mystery, Thriller, Contemporary, Mystery Thriller, Audiobook"
/book/show/2767793-the-hero-of-ages,"""Description contains spoilers for previous book in the series""Who is the Hero of Ages?To end the Final Empire and restore freedom, Vin killed the Lord Ruler. But as a result, the Deepness—the lethal form of the ubiquitous mists—is back, along with increasingly heavy ashfalls and ever more powerful earthquakes. Humanity appears to be doomed.Having escaped death at the climax ofThe Well of Ascensiononly by becoming a Mistborn himself, Emperor Elend Venture hopes to find clues left behind by the Lord Ruler that will allow him to save the world. Vin is consumed with guilt at having been tricked into releasing the mystic force known as Ruin from the Well. Ruin wants to end the world, and its near omniscience and ability to warp reality make stopping it seem impossible. Vin can't even discuss it with Elend lest Ruin learn their plans!","Fantasy, Fiction, Epic Fantasy, High Fantasy, Audiobook, Adult, Magic"
/book/show/21436.Cat_Mouse,"Alex Cross is back, and so is a raging and suicidal Gary Soneji.Out of prison and dying from the AIDS virus he contracted there, Soneji wants revenge on Cross before he dies.There's more. We are introduced to a new pair of rivals whose paths cross those of Cross and Soneji. Thomas Augustine Pierce has been chasing his demon, Mr. Smith, since the savage murder of his fiancée. Smith is a unique monster, with interactions between him and his victims so insane, so unimaginable, that he is thought of as ""not of the earth."" Pierce, known in the business as St. Augustine because of his track record for catching killers and his invaluable status to the FBI and Interpol, may even be better than Cross. When things heat up and Alex is in a near-death coma following a strange attack, Pierce goes to Washington to help investigate. But then he is summoned to Paris with a postcard from Smith inviting him to a very special killing.The body count is high, the tension the highest, and the two killers on the loose are watching every move their pursuers make. Who is the cat, and who is the mouse? What and where is the final trap? And who survives?","Mystery, Fiction, Thriller, Crime, Mystery Thriller, Suspense, Detective"
/book/show/17199504-the-bone-season,"Welcome to Scion. No safer place.The year is 2059. For two centuries, the Republic of Scion has led an oppressive campaign against unnaturalness in Europe.In London, Paige Mahoney holds a high rank in the criminal underworld. The right hand of the ruthless White Binder, Paige is a dreamwalker, a rare and formidable kind of clairvoyant. Under Scion law, she commits treason simply by breathing.When Paige is arrested for murder, she meets the mysterious founders of Scion, who have designs on her uncommon abilities. If she is to survive and escape, Paige must use every skill at her disposal – and put her trust in someone who ought to be her enemy.","Fantasy, Young Adult, Dystopia, Fiction, Science Fiction, Paranormal, Romance"
/book/show/42270835-the-nickel-boys,"Author of The Underground Railroad, Colson Whitehead brilliantly dramatizes another strand of American history through the story of two boys sentenced to a hellish reform school in 1960s Florida.Elwood Curtis has taken the words of Dr Martin Luther King to heart: he is as good as anyone. Abandoned by his parents, brought up by his loving, strict and clear-sighted grandmother, Elwood is about to enroll in the local black college. But given the time and the place, one innocent mistake is enough to destroy his future, and so Elwood arrives at The Nickel Academy, which claims to provide 'physical, intellectual and moral training' which will equip its inmates to become 'honorable and honest men'.In reality, the Nickel Academy is a chamber of horrors, where physical, emotional and sexual abuse is rife, where corrupt officials and tradesmen do a brisk trade in supplies intended for the school, and where any boy who resists is likely to disappear 'out back'. Stunned to find himself in this vicious environment, Elwood tries to hold on to Dr King's ringing assertion, 'Throw us in jail, and we will still love you.' But Elwood's fellow inmate and new friend Turner thinks Elwood is naive and worse; the world is crooked, and the only way to survive is to emulate the cruelty and cynicism of their oppressors.The tension between Elwood's idealism and Turner's skepticism leads to a decision which will have decades-long repercussions.Based on the history of a real reform school in Florida that operated for one hundred and eleven years and warped and destroyed the lives of thousands of children, The Nickel Boys is a devastating, driven narrative by a great American novelist whose work is essential to understanding the current reality of the United States.","Fiction, Historical Fiction, Audiobook, Historical, Race, Literary Fiction, African American"
/book/show/59013666-don-t-just-fly-soar,"Are you struggling to rise above adversity?Looking for the deeper purpose for your life?Don’t Just Fly, tells a deeply personal account of an immigrant conqueror. Markey unveils her own fractured heart, coherent to the sound of humanities cries and painted by her own tears. Cultured calligraphy glides from her quill to depict traces of humankind and specifically where real victory dwells. Only you can define the tapestry of your character and the fashion that it spills into our world.This testimony is more than words, it is life changing motivation to live better. It is a witness that you can achieve professional success, change the narrative dished out to you, harness meaningful relationships, ignite your self-worth and find peace in the most intense storms of life. Drenched with palatable experience and insightful gleans Kelly shows that the power to change your life depends on you despite unfavourable circumstances. A book that’s ignites you to find your goodness guide.In this book, Kelly draws on her life experience wisdom intended to supply guidance and daily help, with all the pitfalls and possibilities to benefit you towards understanding howDefine your purpose and vision for lifeUnderstand the lessons & blessings of your pastCreate authentic & meaningful relationshipsThrive in a world that sometimes feels unfairDesign the future that inspires youDon’t Just Fly, SOAR includes 25 powerful self-help tools for transforming your life and creating a future by design. Each points you toward a better and robust custom of living.This book will guide you to the healing power of empathy and complement the incredible influence of resilience that lurks within you. It will inspire you to shoot for the stars and leave your legacy in the world!_______________________________________________________________________ ‘This book is powerful, it will teach you, it will equip you and it will shape you for a healthier walk in life...what an extraordinary journey and experience that turned out an exceptional woman of our era.’-Liz Naidoo. Editor. Woman of Faith Magazine‘I believe our personal stories are sources of transformation for others...This book will transform your life and birth a new you. Congratulations on picking it up.’- Dr Samuel Ekundayo","Nonfiction, Self Help, Education"
/book/show/12021.The_Crow_Road,"This is an alternative cover edition for ISBN9780349103235'It was the day my grandmother exploded. I sat in the crematorium, listening to my Uncle Hamish quietly snoring in harmont to bach's Mass in B Minor, and I reflected that it always seemed to be death that drew me back to Gallanach.'Prentice McHoan has returned to the bosom of his complex but enduring Scottish family. Full of questions about the McHoan past, present and future, he is also deeply preoccupied: mainly with death, sex, drink, God and illegal substances...","Fiction, Mystery, Contemporary, Scotland, Thriller, Crime, Novels"
/book/show/17162.The_Chocolate_War,"Jerry Renault ponders the question on the poster in his locker:Do I dare disturb the universe?Refusing to sell chocolates in the annual Trinity school fund-raiser may not seem like a radical thing to do. But when Jerry challenges a secret school society called The Vigils, his defiant act turns into an all-out war. Now the only question is: Who will survive? First published in 1974, Robert Cormier's groundbreaking novel, an unflinching portrait of corruption and cruelty, has become a modern classic.ANew York TimesOutstanding Book of the YearAn ALA Best Book for Young AdultsASchool Library Journal Best Book of the Year","Young Adult, Fiction, Classics, Banned Books, Realistic Fiction, School, Teen"
