Book_URL,Summary,Genres
/book/show/935308.Faceless_Killers,"It was a senselessly violent crime: on a cold night in a remote Swedish farmhouse an elderly farmer is bludgeoned to death, and his wife is left to die with a noose around her neck. And as if this didn’t present enough problems for the Ystad police Inspector Kurt Wallander, the dying woman’s last word is foreign, leaving the police the one tangible clue they have–and in the process, the match that could inflame Sweden’s already smoldering anti-immigrant sentiments.Unlike the situation with his ex-wife, his estranged daughter, or the beautiful but married young prosecuter who has piqued his interest, in this case, Wallander finds a problem he can handle. He quickly becomes obsessed with solving the crime before the already tense situation explodes, but soon comes to realize that it will require all his reserves of energy and dedication to solve.--back cover","Mystery, Crime, Fiction, Thriller, Sweden, Mystery Thriller, Scandinavian Literature"
/book/show/10428708-the-affair,"March 1997. A woman has her throat cut behind a bar in Carter Crossing, Mississippi. Just down the road is a big army base. Is the murderer a local guy - or is he a soldier?Jack Reacher, still a major in the military police, is sent in undercover. The county sheriff is a former US Marine - and a stunningly beautiful woman. Her investigation is going nowhere. Is the Pentagon stonewalling her? Or doesn't she really want to find the killer?The adrenaline-pumping, high-voltage action inThe Affairis set just six months before the opening ofKilling Floor, and it marks a turning point in Reacher's career. If he does what the army wants, will he be able to live with himself? And if he doesn't, will the army be able to live with him?Is this his last case in uniform?","Thriller, Fiction, Mystery, Crime, Audiobook, Action, Suspense"
/book/show/4982.The_Sirens_of_Titan,"The Sirens of Titan is an outrageous romp through space, time, and morality. The richest, most depraved man on Earth, Malachi Constant, is offered a chance to take a space journey to distant worlds with a beautiful woman at his side. Of course there's a catch to the invitation—and a prophetic vision about the purpose of human life that only Vonnegut has the courage to tell.","Fiction, Science Fiction, Classics, Humor, Fantasy, Novels, Literature"
/book/show/48757.The_Tao_of_Pooh,"The Wisdom of Pooh.Is there such thing as a Western Taoist? Benjamin Hoff says there is, and this Taoist's favorite food is honey. Through brilliant and witty dialogue with the beloved Pooh-bear and his companions, the author of this smash bestseller explains with ease and aplomb that rather than being a distant and mysterious concept, Taoism is as near and practical to us as our morning breakfast bowl.Romp through the enchanting world of Winnie-the-Pooh while soaking up invaluable lessons on simplicity and natural living.","Philosophy, Nonfiction, Spirituality, Religion, Self Help, Audiobook, Taoism"
/book/show/12094669-caring-for-eleanor,"Is it true that if we are abused, we turn around and abuse others? Not always. A story of courage, caring and starting over. Courage to face life, caring for others in the process and beginning again when all seems lost.When Salma is assigned to Eleanor, she did not expect a life coach. Frail and sick Eleanor opens her eyes to truths that seemed to slip out of her own grasp.",No genres available
/book/show/5056084-wings,"Laurel was mesmerized, staring at the pale things with wide eyes. They were terrifyingly beautiful—too beautiful for words.Laurel turned to the mirror again, her eyes on the hovering petals that floated beside her head. They looked almost like wings.In this extraordinary tale of magic and intrigue, romance and danger, everything you thought you knew about faeries will be changed forever.","Fantasy, Young Adult, Romance, Paranormal, Fairies, Fae, Fiction"
/book/show/25560247-forgotten-lore,"This book is for all lovers of strange and mysterious tales from out of the mists of history. This series is a modest attempt to bring to the world some of the endless weird and wonderful stories, which have been lost and left out of the history books. Our team goes to great lengths to find the most bizarre and inspiring stories, from out of the forgotten archives and hidden vaults of the world. This second volume of the series includes five of our best. They are presented to the public here for the first time, and are sure to delight the history buff or any lover of weird and wonderful tales.",Fantasy
/book/show/44568325-caged-lions-never-roar,"David O’Malley is a former Minor League baseball pitcher turned Anglican Priest who is fed up with the pettiness and hypocrisy of organized religion. He’s conflicted about his priestly vocation.Hannah and David fall in love when they join forces to save two neglected lions from a roadside zoo. But when Hannah’s profession becomes known, the Church orders David to end his relationship with her.Will David choose passion or the priesthood? Can love be a gateway to freedom for two people who are both imprisoned by their own loneliness?",No genres available
/book/show/26889576-the-big-short,"The #1New York Timesbestseller: ""It is the work of our greatest financial journalist, at the top of his game. And it's essential reading.""—Graydon Carter,Vanity FairThe real story of the crash began in bizarre feeder markets where the sun doesn't shine and the SEC doesn't dare, or bother, to tread: the bond and real estate derivative markets where geeks invent impenetrable securities to profit from the misery of lower- and middle-class Americans who can't pay their debts. The smart people who understood what was or might be happening were paralyzed by hope and fear; in any case, they weren't talking.Michael Lewis creates a fresh, character-driven narrative brimming with indignation and dark humor, a fitting sequel to his #1 bestsellerLiar's Poker. Out of a handful of unlikely-really unlikely-heroes, Lewis fashions a story as compelling and unusual as any of his earlier bestsellers, proving yet again that he is the finest and funniest chronicler of our time.","Nonfiction, Business, Economics, Finance, History, Politics, Audiobook"
/book/show/105760.Zodiac,"Who was Zodiac? A serial killer who claimed 37 dead. A sexual sadist who taunted police with anonymous notes. A madman who was never apprehended. This is the first, complete account of Zodiac's reign of terror. Is he still out there?","True Crime, Nonfiction, Crime, History, Mystery, Audiobook, Horror"
/book/show/22609522-red-notice,"A real-life political thriller about an American financier in the Wild East of Russia, the murder of his principled young tax attorney, and his dangerous mission to expose the Kremlin’s corruption.Bill Browder’s journey started on the South Side of Chicago and moved through Stanford Business School to the dog-eat-dog world of hedge fund investing in the 1990s. It continued in Moscow, where Browder made his fortune heading the largest investment fund in Russia after the Soviet Union’s collapse. But when he exposed the corrupt oligarchs who were robbing the companies in which he was investing, Vladimir Putin turned on him and, in 2005, had him expelled from Russia.In 2007, a group of law enforcement officers raided Browder’s offices in Moscow and stole $230 million of taxes that his fund’s companies had paid to the Russian government. Browder’s attorney Sergei Magnitsky investigated the incident and uncovered a sprawling criminal enterprise. A month after Sergei testified against the officials involved, he was arrested and thrown into pre-trial detention, where he was tortured for a year. On November 16, 2009, he was led to an isolation chamber, handcuffed to a bedrail, and beaten to death by eight guards in full riot gear.Browder glimpsed the heart of darkness, and it transformed his life: he embarked on an unrelenting quest for justice in Sergei’s name, exposing the towering cover-up that leads right up to Putin. A financial caper, a crime thriller, and a political crusade,Red Noticeis the story of one man taking on overpowering odds to change the world.","Nonfiction, History, Politics, Russia, Biography, Business, Memoir"
/book/show/52838315-greenlights,"From the Academy Award®–winning actor, an unconventional memoir filled with raucous stories, outlaw wisdom, and lessons learned the hard way about living with greater satisfaction.I’ve been in this life for fifty years, been trying to work out its riddle for forty-two, and been keeping diaries of clues to that riddle for the last thirty-five. Notes about successes and failures, joys and sorrows, things that made me marvel, and things that made me laugh out loud. How to be fair. How to have less stress. How to have fun. How to hurt people less. How to get hurt less. How to be a good man. How to have meaning in life. How to be more me.Recently, I worked up the courage to sit down with those diaries. I found stories I experienced, lessons I learned and forgot, poems, prayers, prescriptions, beliefs about what matters, some great photographs, and a whole bunch of bumper stickers. I found a reliable theme, an approach to living that gave me more satisfaction, at the time, and still: If you know how, and when, to deal with life’s challenges - how to get relative with theinevitable- you can enjoy a state of success I call “catching greenlights.”So I took a one-way ticket to the desert and wrote this book: an album, a record, a story of my life so far. This is fifty years of my sights and seens, felts and figured-outs, cools and shamefuls. Graces, truths, and beauties of brutality. Getting away withs, getting caughts, and getting wets while trying to dance between the raindrops.Hopefully, it’s medicine that tastes good, a couple of aspirin instead of the infirmary, a spaceship to Mars without needing your pilot’s license, going to church without having to be born again, and laughing through the tears.It’s a love letter.To life.It’s also a guide to catching more greenlights - and to realizing that the yellows and reds eventually turn green too.Good luck.","Nonfiction, Audiobook, Memoir, Biography, Autobiography, Biography Memoir, Self Help"
/book/show/32506.The_Poet,"Denver crime-beat reporter Jack McEvoy specializes in violent death. So when his homicide detective brother kills himself, McEvoy copes in the only way he knows how--he decides to write the story. But his research leads him to suspect a serial killer is at work--a devious murderer who's killing cops and leaving a trail of poetic clues. It's the news story of a lifetime, if he can get the story without losing his life.","Mystery, Fiction, Crime, Thriller, Mystery Thriller, Suspense, Detective"
/book/show/18623445-a-disturbed-girl-s-redemption,"Hannah Harker has been broken in every way imaginable and her daughter is being held hostage by deranged eugenicist Sir Virgil Rothwell. Fleeing from a Swiss hospital and supported by reluctant allies, she is forced into a relentlessly bloody cat-and-mouse chase across Europe. While she runs, Rothwell's warped dream to create a master race is becoming a reality. Madness and death have gripped India, and a global pandemic is just weeks away. Hannah's inner demons prove just as fierce as the killers chasing her. She gradually realises that the only route to redemption will be to stop Rothwell and rescue her child. Summoning the last of her strength, the hunted becomes the hunter. A flickering relationship with her Brazilian companion hints at a possible future, but darkness is never far away. In a final, barbaric showdown, Hannah is put through an unspeakable nightmare that pushes her far beyond the limits of physical, mental and emotional endurance. Even if she survives, will there be anything left to identify her as human?""The search for love, sanity and salvation becomes a sickening marathon of depravity.""",Fiction
/book/show/15849310-riptide,"One violent night shatters Lauren Biltmore’s life. As an anchorwoman, she's accustomed to reporting the news rather than being the lead story. She escapes the spotlight by fleeing to her brother's home in the Cayman Islands. Haunted by nightmares, all she wants is a distraction from reality.Distraction arrives via sexy screenwriter, Noah Reynolds. His take-me-to-bed looks mask a past ripe with scandal. He knows he should stay away from Lauren, especially when the worst night of her life unlocks his writer's block and while he's dealing with a stalker of his own, but ethics are his weakness.Attraction sizzles beneath Caribbean sunshine. As their relationship grows, Noah's stalker intensifies her torment. Lauren wonders if her paranoia is justified or a carryover from her past. What's real? What's imagined? Tentative trust is tested as their love is swept up against a riptide of deceit, murder, and revenge.Available in all ebook formats via Bookstrand.com, Amazon.com and BarnesandNoble.com (in September 2012).","Romantic Suspense, Romance, Contemporary Romance, Thriller, Contemporary, Suspense, Adventure"
/book/show/18430056-free-fall,"""Understanding suffering always helps the energy of compassion to be born."" ~ Thich Nhat Hanh In an instant my husband stripped away my identity as wife, stay-at-home mom, and best friend. With his suicide, our world changed forever. He'd been the center of our universe, but then he was gone. Grief is a dark journey, one often tainted with judgment and false perceptions. Add the word 'suicide' to the mix and more complications arise. This memoir, Free Fall, is intended for those who may be facing their own tragedy and feeling alone, hopeless, confused, scared, and misunderstood.Free Fall is the journey of piecing our lives back together—overcoming children's anxiety as we traversed the brutal grief and trauma process, learning to say the words 'widow' and 'single mom' without cringing, surviving the fall out with friends and family who simply couldn't understand our healing process, triumphing over the stigma of 'suicide', forgiving my husband, and finding peace after chaos.Free Fall is for widows, widowers, parents, survivors of suicide, family members or friends of one who mourns. This story is for anyone who needs encouragement that there is another side to grief. There is. We're there now. We're looking back and holding our hands out to you saying, ""hang in there, you're not alone, and you'll get here, too.""","Memoir, Inspirational, Nonfiction, Biography"
/book/show/8755785-city-of-heavenly-fire,"In this dazzling and long-awaited conclusion to the acclaimed Mortal Instruments series, Clary and her friends fight the greatest evil they have ever faced: Clary's own brother.Sebastian Morgenstern is on the move, systematically turning Shadowhunter against Shadowhunter. Bearing the Infernal Cup, he transforms Shadowhunters into creatures out of nightmare, tearing apart families and lovers as the ranks of his Endarkened army swell.The embattled Shadowhunters withdraw to Idris - but not even the famed demon towers of Alicante can keep Sebastian at bay. And with the Nephilim trapped in Idris, who will guard the world against demons?When one of the greatest betrayals the Nephilim have ever known is revealed, Clary, Jace, Isabelle, Simon, and Alec must flee - even if their journey takes them deep into the demon realms, where no Shadowhunter has set foot before, and from which no human being has ever returned...Love will be sacrificed and lives lost in the terrible battle for the fate of the word in the thrilling final installment of the classic urban fantasy series The Mortal Instruments!","Fantasy, Young Adult, Romance, Paranormal, Urban Fantasy, Vampires, Fiction"
/book/show/57223099-surviving-chaos,"For more than fifty years, Harold Phifer's childhood living conditions remained a secret, even from those who thought they knew him best. No one knew about his past growing up with a mother who suffered from mental illness; a greedy, controlling aunt; a mindless and spoiled older brother; an absent father. It wasn't until an explosion in Afghanistan that his memory blasted back into focus. This book is the result of a long, cathartic chat with a stranger at a beach bar, where Harold finally found some peace.","Contemporary, Book Club, Inspirational, Novels, Education, Drama, How To"
/book/show/32191737-grunt,"A New York Times / National Bestseller""America's funniest science writer"" ( Washington Post ) Mary Roach explores the science of keeping human beings intact, awake, sane, uninfected, and uninfested in the bizarre and extreme circumstances of war. Grunt tackles the science behind some of a soldier's most challenging adversaries―panic, exhaustion, heat, noise―and introduces us to the scientists who seek to conquer them. Mary Roach dodges hostile fire with the U.S. Marine Corps Paintball Team as part of a study on hearing loss and survivability in combat. She visits the fashion design studio of U.S. Army Natick Labs and learns why a zipper is a problem for a sniper. She visits a repurposed movie studio where amputee actors help prepare Marine Corps medics for the shock and gore of combat wounds. At Camp Lemmonier, Djibouti, in east Africa, we learn how diarrhea can be a threat to national security. Roach samples caffeinated meat, sniffs an archival sample of a World War II stink bomb, and stays up all night with the crew tending the missiles on the nuclear submarine USS Tennessee. She answers questions not found in any other book on the military: Why is DARPA interested in ducks? How is a wedding gown like a bomb suit? Why are shrimp more dangerous to sailors than sharks? Take a tour of duty with Roach, and you’ll never see our nation’s defenders in the same way again. 15 illustrations","Nonfiction, Science, History, War, Military Fiction, Humor, Audiobook"
/book/show/18170143-an-astronaut-s-guide-to-life-on-earth,"Colonel Chris Hadfield has spent decades training as an astronaut and has logged nearly 4000 hours in space. During this time he has broken into a Space Station with a Swiss army knife, disposed of a live snake while piloting a plane, and been temporarily blinded while clinging to the exterior of an orbiting spacecraft. The secret to Col. Hadfield's success-and survival-is an unconventional philosophy he learned at NASA: prepare for the worst-and enjoy every moment of it.InAn Astronaut's Guide to Life on Earth, Col. Hadfield takes readers deep into his years of training and space exploration to show how to make the impossible possible. Through eye-opening, entertaining stories filled with the adrenaline of launch, the mesmerizing wonder of spacewalks, and the measured, calm responses mandated by crises, he explains how conventional wisdom can get in the way of achievement-and happiness. His own extraordinary education in space has taught him some counterintuitive lessons: don't visualize success, do care what others think, and always sweat the small stuff.You might never be able to build a robot, pilot a spacecraft, make a music video or perform basic surgery in zero gravity like Col. Hadfield. But his vivid and refreshing insights will teach you how tothinklike an astronaut, and will change, completely, the way you view life on Earth-especially your own.","Nonfiction, Science, Biography, Space, Memoir, Audiobook, Autobiography"
/book/show/40963358-dhalgren,"Nebula Award Reality has come unglued and a mad civilization takes root in Bellona, in this science fiction classic.A young half–Native American known as the Kid has hitchhiked from Mexico to the midwestern city Bellona—only something is wrong there . . . In Bellona, the shattered city, a nameless cataclysm has left reality unhinged. Into this desperate metropolis steps the Kid, his fist wrapped in razor-sharp knives, to write, to love, to wound.So begins Dhalgren , Samuel R. Delany’s masterwork, which in 1975 opened a new door for what science fiction could mean. A labyrinth of a novel, it raises questions about race, sexuality, identity, and art, but gives no easy answers, in a city that reshapes itself with each step you take . . .This ebook features an illustrated biography of Samuel R. Delany including rare images from his early career.","Science Fiction, Fiction, Fantasy, Science Fiction Fantasy, Classics, Speculative Fiction, Novels"
/book/show/5805.V_for_Vendetta,"""Remember, remember the fifth of November...""A frightening and powerful tale of the loss of freedom and identity in a chillingly believable totalitarian world,V for Vendettastands as one of the highest achievements of the comics medium and a defining work for creators Alan Moore and David Lloyd.Set in an imagined future England that has given itself over to fascism, this groundbreaking story captures both the suffocating nature of life in an authoritarian police state and the redemptive power of the human spirit which rebels against it. Crafted with sterling clarity and intelligence,V for Vendettabrings an unequaled depth of characterization and verisimilitude to its unflinching account of oppression and resistance.","Graphic Novels, Comics, Fiction, Dystopia, Science Fiction, Graphic Novels Comics, Classics"
/book/show/20663770-death-by-black-hole,"A vibrant collection of essays on the cosmos from the nation's best-known astrophysicist. ""One of today's best popularizers of science.""—Kirkus Reviews.Loyal readers of the monthly ""Universe"" essays inNatural Historymagazine have long recognized Neil deGrasse Tyson's talent for guiding them through the mysteries of the cosmos with stunning clarity and almost childlike enthusiasm. Here, Tyson compiles his favorite essays across a myriad of cosmic topics.The title essay introduces readers to the physics of black holes by explaining the gory details of what would happen to your body if you fell into one. ""Holy Wars"" examines the needless friction between science and religion in the context of historical conflicts. ""The Search for Life in the Universe"" explores astral life from the frontiers of astrobiology. And ""Hollywood Nights"" assails the movie industry's feeble efforts to get its night skies right.Known for his ability to blend content, accessibility, and humor, Tyson is a natural teacher who simplifies some of the most complex concepts in astrophysics while simultaneously sharing his infectious excitement about our universe.","Science, Nonfiction, Physics, Astronomy, Space, Audiobook, Essays"
/book/show/24094.Wolf_Speaker,"When humans start cutting down trees and digging holes in peaceful Dunlath Valley, the wolves know that something is wrong. They send a messenger to the only human who will listen -- Daine, a fourteen-year-old girl with the unpredictable power of wild magic. Daine and her closest companions heed the wolves' cry for help. But the challenge they are about to face in the valley is greater than they can possibly imagine...","Fantasy, Young Adult, Fiction, Magic, Young Adult Fantasy, Adventure, High Fantasy"
/book/show/12734103-haunting-grace,"Having endured years of an abusive marriage, Grace Evans finally walks out on her loveless marriage and boards a train for York. Within hours of arriving in the ancient city, her life is changed forever by a portrait in her hotel room.‘Haunting Grace’, ‘Changing Grace’ and ‘Saving Grace’ have been published in short story form to allow readers the opportunity to sample Ms Marshall’s work. These three books are part of a much larger piece of work; the ‘Highland Secret Series’.‘Beyond Time’ is a compilation of the three ‘Grace’ books and is the second book in the ‘Highland Secret Series’. ‘Beyond Time’ will soon be available in both ebook and paperback format.The first book in the ‘Highland Secret Series’ is ‘When Fate Dictates’; a full 90 000 word novel set in the Scottish Highlands and York and is available as an ebook and paperback.The third book of the series, ‘Entwined’, is due for release shortly and will also be available in ebook and paperback format.","Romance, Paranormal, Fantasy, Ghosts, Fiction, Historical, Time Travel"
/book/show/23506296-why-not-world,"Librarian's note: Alternate cover edition of ISBN 1481959824.Young Elsie Boncoeur is staging a one-girl rebellion against a world full of ignorance and prejudice, but her search for a world based on intelligence and justice leads her into a surreal alternate universe, where Einstein won World War II, the Greek gods were real and the citizenry are guided by the moral precepts of a lost Shakespeare comedy.","Fantasy, Fiction, Dystopia, Young Adult"
