Book_URL,Summary,Genres
/book/show/39933.How_to_Read_Literature_Like_a_Professor,"While many books can be enjoyed for their basic stories, there are often deeper meanings interwoven in these literary texts...How to Read Literature Like a Professorhelps us to discover those hidden truths by looking at literature with the eyes—and the literary codes—of the ultimate professional reader: the college professor.What does it mean when a fictional hero takes a journey? Shares a meal? Gets drenched in a sudden rain shower? Often, there is much more going on in a novel or poem than is readily visible on the surface – a symbol, maybe, that remains elusive, or an unexpected twist on a character – and there's that sneaking suspicion that the deeper meaning of a literary text keeps escaping you.In this practical and amusing guide to literature,Thomas C. Fostershows how easy and gratifying it is to unlock those hidden truths, and to discover a world where a road leads to a quest; a shared meal may signify a communion; and rain, whether cleansing or destructive, is never just rain. Ranging from major themes to literary models, narrative devices and form,How to Read Like a Professoris the perfect companion for making your reading experience more enriching, satisfying and fun.","Nonfiction, School, Books About Books, Writing, Literature, Read For School, Literary Criticism"
/book/show/3872.A_History_of_the_World_in_6_Glasses,"Throughout human history, certain drinks have done much more than just quench thirst. As Tom Standage relates with authority and charm, six of them have had a surprisingly pervasive influence on the course of history, becoming the defining drink during a pivotal historical period.A History of the World in 6 Glassestells the story of humanity from the Stone Age to the 21st century through the lens of beer, wine, spirits, coffee, tea, and cola. Beer was first made in the Fertile Crescent and by 3000 B.C.E. was so important to Mesopotamia and Egypt that it was used to pay wages. In ancient Greece wine became the main export of her vast seaborne trade, helping spread Greek culture abroad. Spirits such as brandy and rum fueled the Age of Exploration, fortifying seamen on long voyages and oiling the pernicious slave trade. Although coffee originated in the Arab world, it stoked revolutionary thought in Europe during the Age of Reason, when coffeehouses became centers of intellectual exchange. And hundreds of years after the Chinese began drinking tea, it became especially popular in Britain, with far-reaching effects on British foreign policy. Finally, though carbonated drinks were invented in 18th-century Europe they became a 20th-century phenomenon, and Coca-Cola in particular is the leading symbol of globalization.For Tom Standage, each drink is a kind of technology, a catalyst for advancing culture by which he demonstrates the intricate interplay of different civilizations. You may never look at your favorite drink the same way again.","History, Nonfiction, Food, Audiobook, Historical, School, Food and Drink"
/book/show/36204075-the-word-is-murder,"SHE PLANNED HER OWN FUNERAL. BUT DID SHE ARRANGE HER OWN MURDER?New York Timesbestselling author ofMagpie MurdersandMoriarty, Anthony Horowitz has yet again brilliantly reinvented the classic crime novel, this time writing a fictional version of himself as the Watson to a modern-day Holmes.One bright spring morning in London, Diana Cowper – the wealthy mother of a famous actor - enters a funeral parlor. She is there to plan her own service.Six hours later she is found dead, strangled with a curtain cord in her own home.Enter disgraced police detective Daniel Hawthorne, a brilliant, eccentric investigator who’s as quick with an insult as he is to crack a case. Hawthorne needs a ghost writer to document his life; a Watson to his Holmes. He chooses Anthony Horowitz.Drawn in against his will, Horowitz soon finds himself a the center of a story he cannot control. Hawthorne is brusque, temperamental and annoying but even so his latest case with its many twists and turns proves irresistible. The writer and the detective form an unusual partnership. At the same time, it soon becomes clear that Hawthorne is hiding some dark secrets of his own.A masterful and tricky mystery that springs many surprises,The Word is Murderis Anthony Horowitz at his very best.","Mystery, Fiction, Audiobook, Crime, Mystery Thriller, Thriller, Detective"
/book/show/71869.Burning_For_Revenge,"The action doesn't let up in the most explosive Tomorrow book yet -- another international bestseller from John Marsden.The journey to Stratton isn't an easy trip, especially when the enemy's headquarters lie somewhere along the way. And that's exactly where Ellie and her friends unwittingly find themselves. With only five of them against hundreds of armed soldiers, escape seems like a suicide mission. But Stratton is where Ellie's grandmother lives, so the journey must be made -- even though the odds aren't good.Ellie must summon all of her courage and guerrilla instincts to survive the latest high-stakes installment of the action-packed Tomorrow series.","Young Adult, Fiction, War, Dystopia, Australia, Adventure, Action"
/book/show/112537.Rendezvous_with_Rama,"At first, only a few things are known about the celestial object that astronomers dub Rama. It is huge, weighing more than ten trillion tons. And it is hurtling through the solar system at an inconceivable speed. Then a space probe confirms the unthinkable: Rama is no natural object. It is, incredibly, an interstellar spacecraft. Space explorers and planet-bound scientists alike prepare for mankind's first encounter with alien intelligence. It will kindle their wildest dreams... and fan their darkest fears. For no one knows who the Ramans are or why they have come. And now the moment of rendezvous awaits — just behind a Raman airlock door.","Science Fiction, Fiction, Science Fiction Fantasy, Audiobook, Space, Classics, Novels"
/book/show/8525590-wither,"By age sixteen, Rhine Ellery has four years left to live. She can thank modern science for this genetic time bomb. A botched effort to create a perfect race has left all males with a lifespan of 25 years, and females with a lifespan of 20 years. Geneticists are seeking a miracle antidote to restore the human race, desperate orphans crowd the population, crime and poverty have skyrocketed, and young girls are being kidnapped and sold as polygamous brides to bear more children.When Rhine is kidnapped and sold as a bride, she vows to do all she can to escape. Her husband, Linden, is hopelessly in love with her, and Rhine can't bring herself to hate him as much as she'd like to. He opens her to a magical world of wealth and illusion she never thought existed, and it almost makes it possible to ignore the clock ticking away her short life. But Rhine quickly learns that not everything in her new husband's strange world is what it seems. Her father-in-law, an eccentric doctor bent on finding the antidote, is hoarding corpses in the basement. Her fellow sister wives are to be trusted one day and feared the next, and Rhine is desperate to communicate to her twin brother that she is safe and alive. Will Rhine be able to escape--before her time runs out?Together with one of Linden's servants, Gabriel, Rhine attempts to escape just before her seventeenth birthday. But in a world that continues to spiral into anarchy, is there any hope for freedom?","Young Adult, Dystopia, Romance, Science Fiction, Fantasy, Fiction, Teen"
/book/show/12262741-wild,"An alternate cover for this ISBN can be foundhere.At twenty-two, Cheryl Strayed thought she had lost everything. In the wake of her mother’s death, her family scattered and her own marriage was soon destroyed. Four years later, with nothing more to lose, she made the most impulsive decision of her life. With no experience or training, driven only by blind will, she would hike more than a thousand miles of the Pacific Crest Trail from the Mojave Desert through California and Oregon to Washington State — and she would do it alone.Told with suspense and style, sparkling with warmth and humor,Wildpowerfully captures the terrors and pleasures of one young woman forging ahead against all odds on a journey that maddened, strengthened, and ultimately healed her.","Nonfiction, Memoir, Travel, Biography, Adventure, Audiobook, Biography Memoir"
/book/show/9517.Persepolis_2,"InPersepolis, heralded by theLos Angeles Timesas ""one of the freshest and most original memoirs of our day,"" Marjane Satrapi dazzled us with her heartrending memoir-in-comic-strips about growing up in Iran during the Islamic Revolution. Here is the continuation of her fascinating story. In 1984, Marjane flees fundamentalism and the war with Iraq to begin a new life in Vienna. Once there, she faces the trials of adolescence far from her friends and family, and while she soon carves out a place for herself among a group of fellow outsiders, she continues to struggle for a sense of belonging.Finding that she misses her home more than she can stand, Marjane returns to Iran after graduation. Her difficult homecoming forces her to confront the changes both she and her country have undergone in her absence and her shame at what she perceives as her failure in Austria. Marjane allows her past to weigh heavily on her until she finds some like-minded friends, falls in love, and begins studying art at a university. However, the repression and state-sanctioned chauvinism eventually lead her to question whether she can have a future in Iran.As funny and poignant as its predecessor,Persepolis 2is another clear-eyed and searing condemnation of the human cost of fundamentalism. In its depiction of the struggles of growing up--here compounded by Marjane's status as an outsider both abroad and at home--it is raw, honest, and incredibly illuminating.","Graphic Novels, Nonfiction, Memoir, Biography, History, Iran, Graphic Novels Comics"
/book/show/2784.Ways_of_Seeing,"John Berger’s Classic Text on ArtWays of Seeingis one of the most stimulating and the most influential books on art in any language. First published in 1972, it was based on the BBC television series about which the (London)Sunday Timesa critic commented: ""This is an eye-opener in more ways than one: by concentrating onhowwe look at paintings . . . he will almost certainly change the way you look at pictures."" By now he has.""Berger has the ability to cut right through the mystification of the professional art critics . . . He is a liberator of images: and once we have allowed the paintings to work on us directly, we are in a much better position to make a meaningful evaluation"" —Peter Fuller,Arts Review""The influence of the series and the book . . . was enormous . . . It opened up for general attention to areas of cultural study that are now commonplace"" —Geoff Dyer inWays of Telling.","Art, Nonfiction, Philosophy, Essays, Art History, Design, Photography"
/book/show/42201395-sorcery-of-thorns,"All sorcerers are evil. Elisabeth has known that as long as she has known anything. Raised as a foundling in one of Austermeer’s Great Libraries, Elisabeth has grown up among the tools of sorcery—magical grimoires that whisper on shelves and rattle beneath iron chains. If provoked, they transform into grotesque monsters of ink and leather. She hopes to become a warden, charged with protecting the kingdom from their power.Then an act of sabotage releases the library’s most dangerous grimoire. Elisabeth’s desperate intervention implicates her in the crime, and she is torn from her home to face justice in the capital. With no one to turn to but her sworn enemy, the sorcerer Nathaniel Thorn, and his mysterious demonic servant, she finds herself entangled in a centuries-old conspiracy. Not only could the Great Libraries go up in flames, but the world along with them.As her alliance with Nathaniel grows stronger, Elisabeth starts to question everything she’s been taught—about sorcerers, about the libraries she loves, even about herself. For Elisabeth has a power she has never guessed, and a future she could never have imagined.","Fantasy, Young Adult, Romance, Young Adult Fantasy, Magic, Fiction, Audiobook"
/book/show/374188.Ghosts,"Written in 1881, when melodrama and farce were still at their peak of popularity, Ibsen’sGhostsis a three-act tragedy that explores uncomfortable, even forbidden themes. It is also a highly critical commentary on the morality of the day. The play centers around the widow of a prominent Norwegian sea captain whose son returns home and, with tragic consequences, revives the ghosts of the past that she has long labored to put to rest.Ghostsimmediately became a source of controversy for its inclusion of topics like venereal disease, incest, and euthanasia, and it was banned from being performed in England for many years. Its arrival signals a shift in the nature of theatre and, despite negative criticism, it was translated into other languages and performed in Sweden, Germany, and New York within a few years of its debut. It stands now as one of the works considered to have ushered in the era of modern drama.","Plays, Classics, Drama, Fiction, Theatre, 19th Century, Scandinavian Literature"
/book/show/19101283-the-son,"The author of the best-selling Harry Hole series now gives us an electrifying stand-alone novel set inside Oslo's maze of especially venal, high-level corruption.Sonny Lofthus is a strangely charismatic and complacent young man. Sonny's been in prison for a dozen years, nearly half his life. The inmates who seek out his uncanny abilities to soothe leave his cell feeling absolved. They don t know or care that Sonny has a serious heroin habit or where or how he gets his uninterrupted supply of the drug. Or that he's serving time for other peoples crimes.Sonny took the first steps toward addiction when his father took his own life rather than face exposure as a corrupt cop. Now Sonny is the seemingly malleable center of a whole infrastructure of corruption: prison staff, police, lawyers, a desperate priest all of them focused on keeping him high and in jail. And all of them under the thumb of the Twin, Oslo's crime overlord. As long as Sonny gets his dope, he's happy to play the criminal and the prison's in-house savior.But when he learns a stunning, long-hidden secret concerning his father, he makes a brilliantly executed escape from prison and from the person he d let himself become and begins hunting down those responsible for the crimes against him . . . The darkly looming question is: Who will get to him first the criminals or the cops?","Crime, Mystery, Thriller, Fiction, Mystery Thriller, Audiobook, Scandinavian Literature"
/book/show/552887.Double_Cross,"Just when Alex thought his life was calming down into a routine of patients and therapy sessions, he finds himself back in the game--this time to catch a criminal mastermind like no other. A spate of elaborate murders in Washington D.C. have the whole East Coast on edge. They are like nothing Alex Cross and his new girlfriend, Detective Brianna Stone, have ever seen. With each murder, the case becomes increasingly complex. There's only one thing Alex knows: the killer adores an audience. As victims are made into gruesome spectacles citywide, inducing a media hysteria, it becomes clear to Alex that the man he's after is a genius of terror--and he's after fame. The killer has the whole city by its strings--and he'll stop at nothing to become the most terrifying star that Washington D.C. has ever seen","Mystery, Fiction, Thriller, Crime, Suspense, Mystery Thriller, Audiobook"
/book/show/6443349-percy-jackson-and-the-olympians-boxed-set,"The complete Percy Jackson & the Olympians series in hardcover, packaged in a gorgeous, reclosable “steamer trunk” fit for demigods. This perfect gift for Percy fans boasts a hidden compartment containing an exclusive Camp Half-Blood map and stickers.","Fantasy, Young Adult, Mythology, Fiction, Adventure, Greek Mythology, Middle Grade"
/book/show/459386.The_Mermaids_Singing,"Val McDermid stunned readers and critics alike with the publication of her brilliant thriller,A PLACE OF EXECUTION,which was a finalist for the prestigious Edgar Award. Now, inTHE MERMAIDS SINGING,she continues her trademark ingenuity for suspense, and introduces criminal profiler Tony Hill, who has spent years exploring the psyches of madmen. But now he's become one of the hunted...YOU ALWAYS REMEMBER THE FIRST TIME...This was the summer he discovered what he wanted—at a gruesome museum of criminology far off the beaten track of more timid tourists. Visions of torture inspired his fantasies like a muse. It would prove so terribly fulfilling.BUT THE NEXT TIME WOULD BE BETTER...The bodies of four men have been discovered in the town of Bradfield. Enlisted to investigate is criminal psychologist Tony Hill. Even for a seasoned professional, the series of mutilation sex murders is unlike anything he's encountered before. But profiling the psychopath is not beyond him. Hill's own past has made him the perfect man to comprehend the killer's motives. It's also made him the perfect victim.AND PRACTICE MAKES PERFECT.A game has begun for the hunter and the hunted. But as Hill confronts his own hidden demons, he must also come face-to-face with an evil so profound he may not have the courage—or the power—to stop it...","Mystery, Crime, Fiction, Thriller, Mystery Thriller, Audiobook, Suspense"
/book/show/12849385-the-innocent,"America has enemies - ruthless people that the police, the FBI, even the military can't stop. That's when the U.S. government calls on Will Robie, a stone cold hitman who never questions orders and always nails his target. But Will Robie may have just made the first - and last - mistake of his career...It begins with a hit gone wrong. Robie is dispatched to eliminate a target unusually close to home in Washington, D.C. But something about this mission doesn't seem right to Robie, and he does the unthinkable. He refuses to kill. Now, Robie becomes a target himself and must escape from his own people.Fleeing the scene, Robie crosses paths with a wayward teenage girl, a fourteen-year-old runaway from a foster home. But she isn't an ordinary runaway -- her parents were murdered, and her own life is in danger. Against all of his professional habits, Robie rescues her and finds he can't walk away. He needs to help her.Even worse, the more Robie learns about the girl, the more he's convinced she is at the center of a vast cover-up, one that may explain her parents' deaths and stretch to unimaginable levels of power.Now, Robie may have to step out of the shadows in order to save this girl's life... and perhaps his own.","Thriller, Fiction, Mystery, Suspense, Audiobook, Crime, Mystery Thriller"
/book/show/569564.The_Complete_Works,TempestTwo Gentlemen of VeronaMerry Wives of WindsorMeasure for MeasureComedy of ErrorsMuch Ado About NothingLove's Labour's LostMidsummer Night's DreamMerchant of VeniceAs You Like ItTaming of the ShrewAll's Well That Ends WellTwelfth NightWinter's TaleKing JohnKing Richard IIKing Henry IV. Part 1King Henry IV. Part 2King Henry VKing Henry VI. Part 1King Henry VI. Part 2King Henry VI. Part 3King Richard IIIKing Henry VIIITroilus and CressidaCoriolanusTitus AndronicusRomeo and JulietTimon of AthensJulius CaesarMacbethHamletKing LearOthelloAnthony and CleopatraCymbelinePericlesVenus and AdonisRape of LucreceSonnetsLover's ComplaintPassionate PilgrimSonnets to Sundry Notes of MusicPhoenix and the Turtle,"Classics, Poetry, Fiction, Plays, Literature, Drama, Classic Literature"
/book/show/5356.The_King_of_Torts,"The office of the public defender is not known as a training ground for bright young litigators. Clay Carter has been there too long and, like most of his colleagues, dreams of a better job in a real firm. When he reluctantly takes the case of a young man charged with a random street killing, he assumes it is just another of the many senseless murders that hit D.C. every week.As he digs into the background of his client, Clay stumbles on a conspiracy too horrible to believe. He suddenly finds himself in the middle of a complex case against one of the largest pharmaceutical companies in the world, looking at the kind of enormous settlement that would totally change his life--that would make him, almost overnight, the legal profession's newest king of torts...'From the Hardcover edition'","Fiction, Thriller, Mystery, Legal Thriller, Crime, Suspense, Mystery Thriller"
/book/show/250113.Novel_with_Cocaine,"A Dostoevskian psychological novel of ideas, Novel with Cocaine explores the interaction between psychology, philosophy, and ideology in its frank portrayal of an adolescent's cocaine addiction. The story relates the formative experiences of Vadim at school and with women before he turns to drug abuse and the philosophical reflections to which it gives rise. Although Ageyev makes little explicit reference to the Revolution, the novel's obsession with addictive forms of thinking finds resonance in the historical background, in which ""our inborn feelings of humanity and justice"" provoke ""the cruelties and satanic transgressions committed in its name.","Fiction, Russia, Classics, Russian Literature, Literature, Novels, 20th Century"
/book/show/7093222-broken,"Karin Slaughter’s internationally bestselling novels are as notable for their vivid portraits of lives shadowed by loss and heartbreak as they are for their dramatic criminal investigations. Broken features the return of her most compelling characters and introduces memorable new ones in a tale of corruption, murder, and confrontation that will leave more than one life . . .When Special Agent Will Trent arrives in Grant County, he finds a police department determined to protect its own and far too many unanswered questions about a prisoner’s death. He doesn’t understand why Officer Lena Adams is hiding secrets from him. He doesn’t understand her role in the death of Grant County’s popular police chief. He doesn’t understand why that man’s widow, Dr. Sara Linton, needs him now more than ever to help her crack this case.While the police force investigates the murder of a young woman pulled from a frigid lake, Trent investigates the police force, putting pressure on Adams just when she’s already about to crack. Caught between two complicated and determined women, trying to understand Linton’s passionate distrust of Adams, the facts surrounding Chief Tolliver’s death, and the complexities of this insular town, Trent will unleash a case filled with explosive secrets—and encounter a thin blue line that could be murderous if crossed.Spellbinding and keenly paced, Broken is Karin Slaughter at her best. Here is an unforgettable story of raw emotions, dangerous assumptions, the deadly and layered game of betrayal, and a man’s determination to expose the most painful of human truths—no matter how deeply they’re hidden . . . or how devastating.","Mystery, Thriller, Crime, Fiction, Suspense, Mystery Thriller, Audiobook"
/book/show/23346757-a-decent-ride,"Shortlisted for the 2015 Bollinger Everyman Wodehouse prize for comic fictionA rampaging force of nature is wreaking havoc on the streets of Edinburgh, but has top shagger, drug-dealer, gonzo-porn-star and taxi-driver, ‘Juice’ Terry Lawson, finally met his match in Hurricane ‘Bawbag’?Can Terry discover the fate of the missing beauty, Jinty Magdalen, and keep heridiot-savantlover, the man-child Wee Jonty, out of prison?Will he find out the real motives of unscrupulous American businessman and reality-TV star, Ronald Checker?And, crucially, will Terry be able to negotiate life after a terrible event robs him of his sexual virility, and can a new fascination for the game of golf help him to live without… A DECENT RIDE?A Decent Ridesees Irvine Welsh back on home turf, leaving us in the capable hands of one of his most compelling and popular characters, ‘Juice’ Terry Lawson, and introducing another bound for cult status, Wee Jonty MacKay: a man with the genitals and brain of a donkey.In his funniest, filthiest book yet, Irvine Welsh celebrates an un-reconstructed misogynist hustler – a central character who is shameless but also, oddly, decent –and finds new ways of making wild comedy out of fantastically dark material, taking on some of the last taboos. So fasten your seatbelts, because this is one ride that could certainly get a little bumpy…","Fiction, Scotland, Contemporary, Novels, Humor, Audiobook, Comedy"
/book/show/40189.A_Year_in_Provence,"In this witty and warm-hearted account, Peter Mayle tells what it is like to realize a long-cherished dream and actually move into a 200-year-old stone farmhouse in the remote country of the Lubéron with his wife and two large dogs. He endures January's frosty mistral as it comes howling down the Rhône Valley, discovers the secrets of goat racing through the middle of town, and delights in the glorious regional cuisine.A Year in Provencetransports us into all the earthy pleasures of Provençal life and lets us live vicariously at a tempo governed by seasons, not by days.","Travel, Nonfiction, Memoir, France, Biography, Food, Humor"
