Book_URL,Summary,Genres
/book/show/1743390.A_Curse_Dark_as_Gold,"This ravishing winner of the ALA's William C. Morris YA Debut Award is a fairy tale, spun with a mystery, woven with a family story, and shot through with romance. Charlotte Miller has always scoffed at talk of a curse on her family's woolen mill, which holds her beloved small town together. But after her father's death, the bad luck piles departing workers, impossible debts, an overbearing uncle. Then a stranger named Jack Spinner offers a tempting He can turn straw into gold thread, for the small price of her mother's ring. As Charlotte is drawn deeper into her bargains with Spinner-and a romance with the local banker-she must unravel the truth of the curse on the mill and save the community she's always called home.","Fantasy, Young Adult, Fairy Tales, Retellings, Historical Fiction, Fiction, Romance"
/book/show/6746018-the-distant-hours,"A long lost letter arrives in the post and Edie Burchill finds herself on a journey to Milderhurst Castle, a great but moldering old house, where the Blythe spinsters live and where her mother was billeted 50 years before as a 13 year old child during WWII. The elder Blythe sisters are twins and have spent most of their lives looking after the third and youngest sister, Juniper, who hasn’t been the same since her fiance jilted her in 1941.Inside the decaying castle, Edie begins to unravel her mother’s past. But there are other secrets hidden in the stones of Milderhurst, and Edie is about to learn more than she expected. The truth of what happened in ‘the distant hours’ of the past has been waiting a long time for someone to find it.Morton once again enthralls readers with an atmospheric story featuring unforgettable characters beset by love and circumstance and haunted by memory, that reminds us of the rich power of storytelling.","Historical Fiction, Fiction, Mystery, Historical, Gothic, Romance, Audiobook"
/book/show/13643567-the-evolution-of-mara-dyer,"“Can we become other than what we are?”Mara Dyer once believed she could run from her past.She can’t.She used to think her problems were all in her head.They aren’t.She couldn’t imagine that after everything she’s been through, the boy she loves would still be keeping secrets.She’s wrong.In this gripping sequel toThe Unbecoming of Mara Dyer, the truth evolves and choices prove deadly.What will become of Mara Dyer next?","Young Adult, Paranormal, Fantasy, Romance, Mystery, Fiction, Supernatural"
/book/show/13359067-a-wanted-man,"Four people in a car, hoping to make Chicago by morning. One man driving, eyes on the road. Another man next to him, telling stories that don’t add up. A woman in the back, silent and worried. And next to her, a huge man with a broken nose, hitching a ride east to Virginia.An hour behind them, a man lies stabbed to death in an old pumping station. He was seen going in with two others, but he never came out. He has been executed, the knife work professional, the killers vanished. Within minutes, the police are notified. Within hours, the FBI descends, laying claim to the victim without ever saying who he was or why he was there.All Reacher wanted was a ride to Virginia. All he did was stick out his thumb. But he soon discovers he has hitched more than a ride. He has tied himself to a massive conspiracy that makes him a threat - to both sides at once.14 hr., 30 min","Thriller, Fiction, Mystery, Crime, Audiobook, Action, Suspense"
/book/show/27.Neither_Here_nor_There,"Bill Bryson's first travel book,The Lost Continent, was unanimously acclaimed as one of the funniest books in years. InNeither Here nor Therehe brings his unique brand of humour to bear on Europe as he shoulders his backpack, keeps a tight hold on his wallet, and journeys from Hammerfest, the northernmost town on the continent, to Istanbul on the cusp of Asia. Fluent in, oh, at least one language, he retraces his travels as a student twenty years before.Whether braving the homicidal motorist of Paris, being robbed by gypsies in Florence, attempting not to order tripe and eyeballs in a German restaurant, window-shopping in the sex shops of the Reeperbahn or disputing his hotel bill in Copenhagen, Bryson takes in the sights, dissects the culture and illuminates each place and person with his hilariously caustic observations. He even goes to Liechtenstein.","Travel, Nonfiction, Humor, Memoir, Audiobook, Biography, Travelogue"
/book/show/52661162-the-searcher,"Retired detective Cal Hooper moves to a remote village in rural Ireland. His plans are to fix up the dilapidated cottage he's bought, to walk the mountains, to put his old police instincts to bed forever.Then a local boy appeals to him for help. His brother is missing, and no one in the village, least of all the police, seems to care. And once again, Cal feels that restless itch.Something is wrong in this community, and he must find out what, even if it brings trouble to his door.","Mystery, Fiction, Audiobook, Thriller, Mystery Thriller, Crime, Ireland"
/book/show/82192.The_Crystal_Cave,"Fifth century Britain is a country of chaos and division after the Roman withdrawal. This is the world of young Merlin, the illegitimate child of a South Wales princess who will not reveal to her son his father's true identity. Yet Merlin is an extraordinary child, aware at the earliest age that he possesses a great natural gift - the Sight. Against a background of invasion and imprisonment, wars and conquest, Merlin emerges into manhood, and accepts his dramatic role in the New Beginning - the coming of King Arthur.","Fantasy, Fiction, Historical Fiction, Arthurian, Historical, Mythology, Classics"
/book/show/331920.Flipped,"Flippedis a romance told in two voices. The first time Juli Baker saw Bryce Loski, she flipped. The first time Bryce saw Juli, he ran. That's pretty much the pattern for these two neighbors until the eighth grade, when, just as Juli is realizing Bryce isn't as wonderful as she thought, Bryce is starting to see that Juli is pretty amazing. How these two teens manage to see beyond the surface of things and come together makes for a comic and poignant romance.","Young Adult, Romance, Fiction, Contemporary, Middle Grade, Realistic Fiction, Childrens"
/book/show/19548967-cracked-hearts,"Some cracked hearts mend . . . and some implode. For the residents of a usually quiet and peaceful neighborhood, life is about to change. Beneath the peaceful and seemingly law-abiding veneer lurks danger, violence, and a festering web of interconnected secrets, lust, and betrayal. Everyone has a secret, tucked away in a private place in their minds, safe from discovery. But dark forces at play will pry open these mental vaults, and soon no one's privacy will be protected. Hearts will shatter, lives will end, relationships will fall apart, and paranoia will sweep the shadows. Some will find perverse thrill in a forbidden love, and others will pay the price for it. Some will move from obsession to violence, and no one's life will be quite as logical as it was before. Every person who touches the life of another leaves a mark. Can neighbors Stephanie, John, and Meg help Ron, Hayley, and Dan conquer their inner demons in time? And will they ever learn the identity of the killer in their midst? Can Zach and Blythe's love survive the trauma? Does love truly conquer all-or does it destroy it?","Romance, Mystery, Psychology"
/book/show/8667848-a-discovery-of-witches,"A richly inventive novel about a centuries-old vampire, a spellbound witch, and the mysterious manuscript that draws them together.Deep in the stacks of Oxford's Bodleian Library, young scholar Diana Bishop unwittingly calls up a bewitched alchemical manuscript in the course of her research. Descended from an old and distinguished line of witches, Diana wants nothing to do with sorcery; so after a furtive glance and a few notes, she banishes the book to the stacks. But her discovery sets a fantastical underworld stirring, and a horde of daemons, witches, and vampires soon descends upon the library. Diana has stumbled upon a coveted treasure lost for centuries-and she is the only creature who can break its spell.Debut novelist Deborah Harkness has crafted a mesmerizing and addictive read, equal parts history and magic, romance and suspense. Diana is a bold heroine who meets her equal in vampire geneticist Matthew Clairmont, and gradually warms up to him as their alliance deepens into an intimacy that violates age-old taboos. This smart, sophisticated story harks back to the novels of Anne Rice, but it is as contemporary and sensual as the Twilight series-with an extra serving of historical realism.","Fantasy, Romance, Fiction, Paranormal, Vampires, Witches, Magic"
/book/show/448873.The_Thief,"Nothing is overdone and not a word is out of place in this auspicious debut,"" wrote Kirkus in a starred review ofInstead of Three Wishes,the first book by Megan Whalen Turner. Her second book more than fulfills that promise.The king's scholar, the magus, believes he knows the site of an ancient treasure. To attain it for his king, he needs a skillful thief, and he selects Gen from the king's prison. The magus is interested only in the thief's abilities. What Gen is interested in is anyone's guess. Their journey toward the treasure is both dangerous and difficult, lightened only imperceptibly by the tales they tell of the old gods and goddesses.Megan Whalen Turner weaves Gen's stories and Gen's story together with style and verve in a novel that is filled with intrigue, adventure, and surprise.","Fantasy, Young Adult, Fiction, Adventure, Historical Fiction, Young Adult Fantasy, Audiobook"
/book/show/33560584-tiger-and-the-robot,"She lives in the cloud, and travels in a phone.She’s Saga, Artificial Intelligence Detective.The exciting action of the Swiftsure Yacht race launches an adventure which ranges from the urban landscape of Vancouver to the wild islands of Alaska.Chandler Gray, a sailor and software developer has created Saga (Say-Gah), an Artificial Intelligence app which emulates the powers of fiction’s greatest detectives.A chance encounter with the wealthy, glamorous Gina Lee, leads to an invitation to sail on her yacht in the Swiftsure race. When Gina is kidnapped, Saga falsely claims Chan is a Private Investigator, and he takes on the rescue.Sometimes bumbling, but always determined, Chan and Saga roll through adventures in flight, at sea and on the ground. With a band of friends providing support, and sometimes derision, Chan doggedly pursues the truth, no matter where it leads.The quest leads to piracy in the Aleutians, a Land Rover attacked in the backwoods of Vancouver Island, and a lover’s betrayal. Saga’s remarkable abilities don’t always lead in the right direction, and her sassy attitude sometimes annoys Chan, but in the end they make an effective team.",Fiction
/book/show/71863.A_Killing_Frost,"Life in the war zone enters its sixth month of heart-stopping tension in the latest installment of the internationally bestselling Tomorrow series.In the third installment of the Tomorrow saga, the anything-to-survive existence of Ellie and her friends has sharpened their senses and emboldened their plans. They aren't merely on the defensive anymore; they're also striking back. Their strategy? Attack the enemy not just on land, but also on water. If they have any hope of sabotaging the formidable container ship at Cobbler's Bay, then stealth is a must, but so, too, is one very big explosion.And if they fail, they may face a whole new kind of terror -- imprisonment.","Young Adult, Fiction, War, Dystopia, Australia, Adventure, Action"
/book/show/33506239-is-goat-beef,"IS GOAT BEEF? is a labor of love.It is a book that combines the author's loveof humor, food, and his military service.IS GOAT BEEF? shows the humorousside of the military and how service membersrelax during times of conflict.","Nonfiction, Humor, War, True Story, Military Fiction, History, Adult"
/book/show/432342.Diary_of_a_Drug_Fiend,"Diary of a Drug Fiend (1922) is a novel by Aleister Crowley. Published at the height of his career as a poet and occultist, his debut novel draws on Crowley's experiences as a heroin addict. Despite his lifelong struggle, Crowley's penchant for recreational drug use and scientific informed many of the tenets of his religion Thelema. Diary of a Drug Fiend would inspire such musicians as Ozzy Osbourne, The Lemonheads, and The Beatles. Before there was Sir Peter Pendragon, decorated pilot and veteran of the First World War, there was Peter, a dedicated medical student with his whole life ahead of him. After the war, he struggles with depression and ennui while living off an inheritance from a deceased uncle. Alongside his lover Louise Laleham, he develops a passion for heroin and cocaine, which lead them across Europe in a series of drug-fueled escapades. Back in England, they attempt to use magick as a means of breaking their dependencies, but soon find themselves hopelessly lost in the world of addiction. At their lowest point, they meet Basil King Lamus, a powerful magician who offers them a way out. With a beautifully designed cover and professionally typeset manuscript, this edition of Aleister Crowley's Diary of a Drug Fiend is a classic of English literature reimagined for modern readers.","Fiction, Occult, Classics, Philosophy, Thelema, Magic, Novels"
/book/show/10852.Cosmic_Banditos,"Soon to be a major motion picture starring John Cusack ! Mr. Quark is a down-on-his luck pot-smuggler hiding out in the mountains of Colombia with his dog, High Pockets, and a small band of banditos led by the irascible Jose. Only months before, these three and their fearless associates were rolling in millions in cash and high-grade marijuana, eluding prosecution on “ridiculously false” drug and terrorism charges. But times have quickly grown lean, and to liven up their exile, Jose decides to mug a family of American tourists. Among the spoils are physics texts, which launch Mr. Quark on a side-splitting, boisterous adventure north to California, where he confronts the owner of the books with his own theories on relativity, the nature of the universe, and looking for the meaning of life in all the wrong places….","Fiction, Comedy, Humor, Science Fiction, Adventure, Audiobook, Novels"
/book/show/41899.Fantastic_Beasts_and_Where_to_Find_Them,"A copy ofFantastic Beasts and Where to Find Themresides on almost every wizarding household in the country. Now, for a limited period only, Muggles too have the chance to discover where the Quintaped lives, what the Puffskein eats, and why it is best not to leave milk out for a Knarl.Proceeds from the sale of this book will go to improving and saving the lives of children around the world, which means that the dollars and Galleons you exchange for it will do magic beyond the powers of any wizard. If you feel that this is insufficient reason to part with your money, I can only hope most sincerel that passing wizards feel more charitable if they ever see you being attacked by a Manticore.-Albus Dumbledore","Fantasy, Fiction, Young Adult, Magic, Childrens, Middle Grade, Audiobook"
/book/show/23492589-finders-keepers,"Wake up, genius.The genius is John Rothstein, an iconic author who created a famous character, Jimmy Gold, but who hasn’t published a book for decades. Morris Bellamy is livid, not just because Rothstein has stopped providing books, but because the nonconformist Jimmy Gold has sold out for a career in advertising. Morris kills Rothstein and empties his safe of cash, yes, but the real treasure is a trove of notebooks containing at least one more Gold novel.Morris hides the money and the notebooks, and then he is locked away for another crime. Decades later, a boy named Pete Saubers finds the treasure, and now it is Pete and his family that Bill Hodges, Holly Gibney, and Jerome Robinson must rescue from the ever-more deranged and vengeful Morris when he’s released from prison after thirty-five years.Not since Misery has King played with the notion of a reader whose obsession with a writer gets dangerous. Finders Keepers is spectacular, heart-pounding suspense, but it is also King writing about how literature shapes a life—for good, for bad, forever.","Fiction, Horror, Thriller, Mystery, Crime, Audiobook, Mystery Thriller"
/book/show/65119.The_Miserable_Mill,"Dear Reader,I hope, for your sake, that you have not chosen to read this book because you are in the mood for a pleasant experience. If this is the case, I advise you to put this book down instantaneously, because of all the books describing the unhappy lives of the Baudelaire orphans, The Miserable Mill might be the unhappiest yet. Violet, Klaus, and Sunny Baudelaire are sent to Paltryville to work in a lumber mill, and they find disaster and misfortune lurking behind every log.The pages of this book, I'm sorry to inform you, contain such unpleasantries as a giant pincher machine, a bad casserole, a man with a cloud of smoke where his head should be, a hypnotist, a terrible accident resulting in injury, and coupons.I have promised to write down the entire history of these three poor children, but you haven't, so if you prefer stories that are more heartwarming, please feel free to make another selection.With all due respect,Lemony Snicket","Fiction, Young Adult, Childrens, Middle Grade, Fantasy, Mystery, Adventure"
/book/show/8809.The_Wanting_Seed,"Set in the near future,  The Wanting Seed  is a Malthusian comedy about the strange world overpopulation will produce. Tristram Foxe and his wife, Beatrice-Joanna, live in their skyscraper world where official family limitation glorifies homosexuality. Eventually, their world is transformed into a chaos of cannibalistic dining-clubs, fantastic fertility rituals, and wars without anger. It is a novel both extravagantly funny and grimly serious.","Fiction, Science Fiction, Dystopia, Classics, British Literature, Literature, Novels"
/book/show/18877989-people-who-eat-darkness,"Lucie Blackman—tall, blond, twenty-one years old—stepped out into the vastness of Tokyo in the summer of 2000, and disappeared forever. The following winter, her dismembered remains were found buried in a seaside cave.Richard Lloyd Parry, an award-winning foreign correspondent, covered Lucie's disappearance and followed the massive search for her, the long investigation, and the even longer trial. Over ten years, he earned the trust of her family and friends, won unique access to the Japanese detectives and Japan's convoluted legal system, and delved deep into the mind of the man accused of the crime, Joji Obara, described by the judge as ""unprecedented and extremely evil.""The result is a book at once thrilling and revelatory, ""In Cold Bloodfor our times"" (Chris Cleave, author ofIncendiaryandLittle Bee).The People Who Eat Darknessis one ofPublishers Weekly's Top 10 Best Books of 2012","True Crime, Nonfiction, Crime, Japan, Audiobook, Mystery, History"
/book/show/40873920-the-lost-city-of-the-monkey-god,"A five-hundred-year-old legend. An ancient curse. A stunning medical mystery. And a pioneering journey into the unknown heart of the world's densest jungle.Since the days of conquistador Hernán Cortés, rumors have circulated about a lost city of immense wealth hidden somewhere in the Honduran interior, called the White City or the Lost City of the Monkey God. Indigenous tribes speak of ancestors who fled there to escape the Spanish invaders, and they warn that anyone who enters this sacred city will fall ill and die. In 1940, swashbuckling journalist Theodore Morde returned from the rainforest with hundreds of artifacts and an electrifying story of having found the Lost City of the Monkey God-but then committed suicide without revealing its location.Three quarters of a century later, author Doug Preston joined a team of scientists on a groundbreaking new quest. In 2012 he climbed aboard a rickety, single-engine plane carrying the machine that would change everything: lidar, a highly advanced, classified technology that could map the terrain under the densest rainforest canopy. In an unexplored valley ringed by steep mountains, that flight revealed the unmistakable image of a sprawling metropolis, tantalizing evidence of not just an undiscovered city but an enigmatic, lost civilization.Venturing into this raw, treacherous, but breathtakingly beautiful wilderness to confirm the discovery, Preston and the team battled torrential rains, quickmud, disease-carrying insects, jaguars, and deadly snakes. But it wasn't until they returned that tragedy struck: Preston and others found they had contracted in the ruins a horrifying, sometimes lethal-and incurable-disease.","Nonfiction, History, Adventure, Travel, Science, Audiobook, Archaeology"
/book/show/17346698-march,"March is a vivid first-hand account of John Lewis' lifelong struggle for civil and human rights, meditating in the modern age on the distance traveled since the days of Jim Crow and segregation. Rooted in Lewis' personal story, it also reflects on the highs and lows of the broader civil rights movement.Book One spans John Lewis' youth in rural Alabama, his life-changing meeting with Martin Luther King, Jr., the birth of the Nashville Student Movement, and their battle to tear down segregation through nonviolent lunch counter sit-ins, building to a stunning climax on the steps of City Hall.Many years ago, John Lewis and other student activists drew inspiration from the 1950s comic bookMartin Luther King and the Montgomery Story. Now, his own comics bring those days to life for a new audience, testifying to a movement whose echoes will be heard for generations.(Back flap)","Graphic Novels, Nonfiction, History, Memoir, Comics, Biography, Historical"
/book/show/13595639-the-name-of-the-star,"Jack the Ripper is back, and he's coming for Rory next....Louisiana teenager Rory Deveaux arrives in London to start a new life at boarding school just as a series of brutal murders mimicking the horrific Jack the Ripper killing spree of more than a century ago has broken out across the city. The police are left with few leads and no witnesses. Except one. Rory spotted the man believed to be the prime suspect. But she is the only one who saw him - the only one whocansee him. And now Rory has become his next target...unless she can tap her previously unknown abilities to turn the tables.","Young Adult, Mystery, Fantasy, Paranormal, Ghosts, Fiction, Horror"
/book/show/123201095-stranger-on-the-shore,"This spellbinding fictional story spins a web of linked mysteries about a beautiful young woman, Marisa, who is found almost lifeless on the bank of the East River in New York City. The Investigating Detective’s preliminary conclusion -- she “must have fallen out of the sky.”Chris, grieving the loss of his fiancé Theresa, meets the enigmatic Arielle on the beach and agrees to meet her at a party. However, when he arrives at the party, he finds no sign of Arielle, but instead meets Marisa, a waitress who bears an uncanny resemblance to Theresa and even possesses her complete memory. Chris is stunned by the coincidence and wonders if everything is part of some greater plan orchestrated by Arielle.As the story unfolds, Marisa's identity is revealed and her destiny to face one of the most notorious cartel leaders in a deadly battle becomes clear. Along the way, Ana and Chris develop a tumultuous love affair, which ultimately leads Chris to fight by Ana's side as she battles the cartel leader. But the story takes a twist when the mysterious Arielle appears at the most critical moment in the fight, adding another layer of mystery to the tale. Will Chris and Marisa triumph over their foes and find happiness together, or will the forces against them prove too strong? Follow along as Stranger on the Shore unravels these mysteries and more.","Novels, Contemporary, Drama"
/book/show/6604794-the-sky-is-everywhere,"Adrift after her sister Bailey's sudden death, Lennie finds herself torn between quiet, seductive Toby—Bailey's boyfriend who shares her grief—and Joe, the new boy in town who bursts with life and musical genius. Each offers Lennie something she desperately needs... though she knows if the two of them collide her whole world will explode.Join Lennie on this heartbreaking and hilarious journey of profound sorrow and mad love, as she makes colossal mistakes and colossal discoveries, as she traipses through band rooms and forest bedrooms and ultimately right into your heart.As much a celebration of love as a poignant portrait of loss, Lennie's struggle to sort her own melody out of the noise around her is always honest, often uproarious, and absolutely unforgettable.","Young Adult, Romance, Contemporary, Fiction, Realistic Fiction, Young Adult Contemporary, Death"
/book/show/6381205-soulless,"Alexia Tarabotti is laboring under a great many social tribulations.First, she has no soul. Second, she's a spinster whose father is both Italian and dead. Third, she was rudely attacked by a vampire, breaking all standards of social etiquette.Where to go from there? From bad to worse apparently, for Alexia accidentally kills the vampire--and then the appalling Lord Maccon (loud, messy, gorgeous, and werewolf) is sent by Queen Victoria to investigate.With unexpected vampires appearing and expected vampires disappearing, everyone seems to believe Alexia responsible. Can she figure out what is actually happening to London's high society? Will her soulless ability to negate supernatural powers prove useful or just plain embarrassing? Finally, who is the real enemy, and do they have treacle tart?","Steampunk, Fantasy, Romance, Paranormal, Vampires, Urban Fantasy, Fiction"
